"orig_address","orig_lat","orig_lng","dest_address","dest_lat","dest_lng","time_text","distance_value","straight_dis","avg_speed"
"Onoway, AB T0E, Canada",53.7017507,-114.1982174,"Sainte-Jeanne-d'Arc, QC G0W, Canada",48.8651447,-72.0808681,"1 day 15 hours",3706.483,2942.18366260929,95.1091542820486
"Halkirk, AB T0C, Canada",52.2830849,-112.1539573,"Crawford Bay, BC V0B, Canada",49.6812105,-116.8246874,"8 hours 58 mins",820.514,437.29635556355,91.5213137103021
"Trochu, AB T0M, Canada",51.8238185,-113.2327451,"Slocan, BC V0G, Canada",49.7630058,-117.4699201,"8 hours 26 mins",724.794,376.479093874853,85.8760663507109
"Calling Lake, AB T0G, Canada",55.2104515,-113.1930038,"Yarker, ON K0H, Canada",44.3715924,-76.7702688,"1 day 12 hours",3855.556,2844.14993459372,106.493997053769
"Wildwood, AB T0E, Canada",53.6098413,-115.235512,"Blezard Valley, ON P0M, Canada",46.608626,-81.0524354,"1 day 7 hours",3036.947,2537.94728874532,96.5174063120724
"Hines Creek, AB T0H, Canada",56.24739,-118.6015103,"Cottam, Kingsville, ON N0R, Canada",42.1307467,-82.7448302,"1 day 11 hours",3686.061,2999.03882127552,105.669097540194
"High Prairie, AB T0G, Canada",55.4337549,-116.4877008,"Brights Grove, Sarnia, ON N0N, Canada",43.0335671,-82.25241,"1 day 10 hours",3549.046,2808.83015741353,105.728636329783
"Burdett, AB T0K, Canada",49.8330823,-111.521335,"Roberval, QC, Canada",48.5187203,-72.2219808,"1 day 12 hours",3415.444,2836.21008253728,95.8698697106501
"Glenwood, AB T0K, Canada",49.3653908,-113.5164252,"Clearwater, BC V0E, Canada",51.6511258,-120.0379356,"10 hours 2 mins",892.533,527.609792905525,88.9395410634705
"Silver Valley, AB T0H, Canada",56.042866,-119.5663356,"Burk's Falls, ON P0A, Canada",45.6198906,-79.4087198,"1 day 15 hours",3761.197,3004.8113731519,97.5217452680706
"Rochester, AB T0G, Canada",54.3709115,-113.4551359,"Saint-André-Avellin, QC J0V, Canada",45.7065816,-75.0564208,"1 day 13 hours",3599.347,2872.66236596395,95.9939637290346
"Turner Valley, AB T0L, Canada",50.6739091,-114.278862,"Saint-Chrysostome, QC J0S, Canada",45.1026152,-73.7608609,"1 day 13 hours",3552.468,3052.67511180699,96.2134545071546
"Sexsmith, AB T0H, Canada",55.3503229,-118.7834598,"Stellarton, NS, Canada",45.5567727,-62.6603637,"2 days 5 hours",5235.226,4012.32232671512,99.0217706089424
"Bonnyville, AB, Canada",54.2679649,-110.7200364,"Dubreuilville, ON P0S, Canada",48.3484004,-84.550641,"1 day 0 hours",2365.878,1926.54164710908,96.936831203123
"Wetaskiwin, AB, Canada",52.9698702,-113.3771616,"Wikwemikong, ON P0P, Canada",45.8036527,-81.7214966,"1 day 7 hours",2912.628,2409.27682280266,94.9125213849287
"Grassy Lake, AB T0K, Canada",49.8257207,-111.6980107,"Baldur, MB R0K, Canada",49.3854199,-99.2438425,"9 hours 30 mins",979.23,900.486329069453,103.070814572247
"Radway, AB T0A, Canada",54.0645567,-112.9464694,"Hanley, SK S0G, Canada",51.6279058,-106.4395898,"5 hours 44 mins",590.928,515.183004660197,103.09381148534
"Wainwright, AB, Canada",52.83307,-110.850458,"Leader, SK S0N, Canada",50.8889728,-109.5419038,"3 hours 11 mins",316.631,234.331843004126,99.309252483011
"Waskatenau, AB T0A, Canada",54.0954101,-112.7833297,"Marten River, ON P0H, Canada",46.73331,-79.8018987,"1 day 7 hours",3036.108,2456.58802790327,96.4030834906243
"Edmonton, AB, Canada",53.5443894,-113.4909209,"Azilda, Sudbury, ON P0M, Canada",46.5516548,-81.114993,"1 day 6 hours",2914.826,2421.27102539839,96.1565647679789
"Rumsey, AB T0J, Canada",51.843005,-112.83855,"Port McNeill, BC, Canada",50.5901635,-127.0844713,"18 hours 2 mins",1560.029,1003.42205522891,86.53340318331
"Hughenden, AB T0B, Canada",52.5117596,-110.9655744,"Kleinburg, Vaughan, ON L0J, Canada",43.8385567,-79.6234162,"1 day 7 hours",3270.015,2497.72080198599,106.444838280904
"Raymond, AB T0K, Canada",49.4635387,-112.6621989,"Holberg, BC V0N, Canada",50.6517653,-128.0260805,"20 hours 36 mins",1721.724,1106.08537629354,83.5574273042236
"Gift Lake Metis Settlement, AB T0G, Canada",55.8816192,-115.8248271,"Ham-Nord, QC, Canada",45.8948388,-71.6334378,"1 day 19 hours",4143.42,3236.92362589596,95.6646036825869
"Caroline, AB T0M, Canada",52.0935949,-114.7404503,"Luseland, SK S0L, Canada",52.0818337,-109.3900545,"4 hours 27 mins",426.349,366.655322359295,95.7072020951549
"Edson, AB, Canada",53.5862378,-116.4418213,"Oliver, BC, Canada",49.1823356,-119.5504496,"9 hours 22 mins",881.638,535.494302070884,94.0525336336158
"Bentley, AB T0C, Canada",52.4651054,-114.0500486,"Muskoka Falls, Gravenhurst, ON P0B, Canada",44.9922601,-79.2978117,"1 day 9 hours",3172.675,2658.51695992278,95.1945291793769
"Langdon, AB T0J, Canada",50.9732416,-113.6795084,"Whitehorse, YT, Canada",60.7210782,-135.0567564,"1 day 3 hours",2271.042,1710.02495909888,84.2904397133873
"Clyde, AB T0G, Canada",54.1485531,-113.6354839,"Welsford, NB E5K, Canada",45.4560294,-66.3416224,"1 day 22 hours",4498.603,3467.32972752904,97.4901775233417
"Fort Mackay, AB, Canada",57.1867397,-111.6369184,"Percé, QC, Canada",48.52444,-64.2124189,"2 days 4 hours",4926.446,3262.12108179806,95.6410904090382
"Morrin, AB T0J, Canada",51.6601335,-112.7648487,"Lundar, MB R0C, Canada",50.698002,-98.041608,"11 hours 20 mins",1129.696,1033.32144889357,99.6497500735078
"Drumheller, AB, Canada",51.4651849,-112.7106975,"Franklin Centre, QC J0S, Canada",45.0293501,-73.9237272,"1 day 12 hours",3496.713,2930.93302027631,96.2140619864715
"Alberta Beach, AB T0E, Canada",53.6760351,-114.3548573,"908 Lockhart Rd, Innisfil, ON L9S 3G7, Canada",44.3465036,-79.555803,"1 day 10 hours",3277.618,2715.09726776651,96.8380411499668
"Heinsburg, AB T0A, Canada",53.7704877,-110.5269043,"Benoit's Cove, Humber Arm South, NL A0L, Canada",49.009517,-58.131688,"2 days 14 hours",5276.122,3600.63855825152,85.6729657561433
"Donnelly, AB T0H, Canada",55.7272773,-117.1054519,"Maniwaki, QC, Canada",46.3774851,-75.9649017,"1 day 15 hours",3759.033,3013.76478363435,96.818524454111
"Heisler, AB T0B, Canada",52.670258,-112.2202969,"Port Renfrew, BC V0S, Canada",48.5529755,-124.4223238,"17 hours 10 mins",1412.531,975.852230791366,82.2620616021742
"Mannville, AB T0B, Canada",53.3359791,-111.1758788,"Geraldton, ON P0T, Canada",49.725298,-86.9494953,"21 hours 36 mins",2105.878,1719.42637642209,97.4830690892258
"Worsley, AB T0H, Canada",56.5080328,-119.1336255,"Upper Horsefly Rd, Horsefly, BC V0L 1L0, Canada",52.332891,-121.4163792,"9 hours 55 mins",844.422,487.727194126159,85.1446433072851
"Thorhild, AB T0A, Canada",54.1532592,-113.1258214,"Ridgetown, Chatham-Kent, ON N0P, Canada",42.4391791,-81.8871222,"1 day 7 hours",3225.962,2627.70423715571,105.728803190037
"Alliance, AB, Canada",52.4359107,-111.7846431,"Shediac, NB, Canada",46.2202141,-64.5346859,"1 day 22 hours",4472.267,3438.87254924837,97.4928316236935
"Clive, AB T0C, Canada",52.4778347,-113.44745,"Freelton, Hamilton, ON, Canada",43.3977476,-80.036782,"1 day 8 hours",3396.02,2662.99481770819,106.091550456885
"Winfield, AB T0C, Canada",52.9635171,-114.4126121,"Warkworth, Trent Hills, ON K0K, Canada",44.2019746,-77.8870645,"1 day 11 hours",3668.216,2829.0537868265,105.974413173797
"New Dayton, AB T0K, Canada",49.4268526,-112.3792497,"Fort-Coulonge, QC, Canada",45.8415624,-76.7383333,"1 day 9 hours",3158.396,2682.29515058671,96.2208516688105
"Wabamun, AB T0E, Canada",53.5588437,-114.4687994,"Chance Cove, NL A0B, Canada",47.6831773,-53.822884,"2 days 21 hours",6053.335,4208.43009726137,87.3861398049532
"Edgerton, AB T0B, Canada",52.7601131,-110.4584788,"Carcross, YT Y0B, Canada",60.1674656,-134.7076119,"1 day 2 hours",2206.554,1693.29800355892,83.8418322866642
"Gleichen, AB T0J, Canada",50.866153,-113.051597,"Elkford, BC V0B, Canada",50.0245631,-114.9235196,"3 hours 25 mins",314.645,162.607166086635,92.1961582288784
"Bon Accord, AB, Canada",53.8372586,-113.4121256,"Coaticook, QC, Canada",45.1337603,-71.8041913,"1 day 15 hours",3759.504,3115.11266227508,95.6468064055632
"Hays, AB T0K, Canada",50.0944136,-111.8000729,"Fingal, ON N0L, Canada",42.7125202,-81.3108887,"1 day 4 hours",2996.218,2463.52727475711,106.522726868723
"Craigmyle, AB T0J, Canada",51.6694238,-112.2491559,"Allardville, NB E8L, Canada",47.474778,-65.492439,"1 day 20 hours",4258.363,3354.96745963737,96.562127501433
"Iron Springs, AB T0K, Canada",49.9315232,-112.6889222,"Wapella, SK S0G, Canada",50.2615536,-101.9720161,"7 hours 59 mins",837.11,767.031713322226,104.944839114083
"Eaglesham, AB T0H, Canada",55.782235,-117.88065,"Thrums, BC V1N, Canada",49.3541991,-117.5777446,"13 hours 40 mins",1272.685,715.590760232663,93.1630574025499
"Longview, AB T0L, Canada",50.5313419,-114.2337204,"Latchford, ON, Canada",47.329887,-79.810964,"1 day 7 hours",3012.528,2524.03279115522,98.0294926376874
"Girouxville, AB T0H, Canada",55.7539583,-117.3386639,"Armstrong, ON P0T, Canada",50.2956232,-89.0517589,"1 day 4 hours",2559.593,1976.74252785073,92.491265332343
"Wandering River, AB T0A, Canada",55.2015668,-112.4660805,"Évain, QC J0Z, Canada",48.2391479,-79.1285185,"1 day 8 hours",3078.169,2403.53178917667,96.3223816767352
"Donalda, AB T0B, Canada",52.5846882,-112.5760285,"Chelsea, QC, Canada",45.5306639,-75.8678747,"1 day 12 hours",3376.459,2761.59243726161,94.8140217314997
"Irma, AB T0B, Canada",52.9133542,-111.2302567,"Hampton, ON L0B, Canada",43.970497,-78.744615,"1 day 7 hours",3361.127,2573.29909910627,106.774003741485
"Czar, AB T0B, Canada",52.4532162,-110.8254472,"McLeese Lake, BC V0K, Canada",52.4153977,-122.2895691,"12 hours 7 mins",1172.995,778.884224505729,96.7551553478141
"DeBolt, AB T0H, Canada",55.2142405,-118.0261065,"Petrolia, ON N0N, Canada",42.8818215,-82.1444389,"1 day 10 hours",3610.94,2915.40994328128,106.439780887422
"East Coulee, Drumheller, AB T0J, Canada",51.3363087,-112.4894221,"South River, ON P0A, Canada",45.8410546,-79.3795761,"1 day 7 hours",2954.683,2494.67065789744,95.5134808961523
"Lougheed, AB T0B, Canada",52.7456312,-111.5444846,"Cap-des-Rosiers, QC G0E, Canada",48.8650665,-64.2107165,"1 day 22 hours",4331.352,3303.14941299013,94.7969578142954
"Woking, AB T0H, Canada",55.5923302,-118.7761112,"Gaultois, NL, Canada",47.609932,-55.9051714,"3 days 1 hour",6394.688,4289.39996737087,87.2951913633382
"Cessford, AB T0J, Canada",51.0086148,-111.5610349,"Middle Lake, SK S0K, Canada",52.4814277,-105.3026752,"5 hours 32 mins",539.29,462.080017810408,97.5256944793289
"New Sarepta, AB T0C, Canada",53.2723122,-113.1472225,"Maynooth, ON K0L, Canada",45.2308636,-77.9386173,"1 day 10 hours",3261.594,2682.6003296181,95.0524848416161
"Redwater, AB T0A, Canada",53.9502921,-113.1086987,"McCreary, MB R0J, Canada",50.7747112,-99.493735,"10 hours 52 mins",1102.38,990.557829568988,101.52386799693
"Irricana, AB T0M, Canada",51.3189655,-113.6105289,"Richibucto, NB E4W, Canada",46.6817494,-64.8659617,"1 day 22 hours",4475.463,3536.75876931469,96.8214295157626
"Strathmore, AB, Canada",51.0378591,-113.4002871,"Saint-Gédéon, QC, Canada",48.539838,-71.7899519,"1 day 14 hours",3644.044,2969.01815618042,96.1700637783154
"Oyen, AB T0J, Canada",51.3518811,-110.4826119,"Trois-Pistoles, QC, Canada",48.1192778,-69.1652792,"1 day 15 hours",3796.798,2960.09715962719,96.7624686743406
"Sangudo, AB, Canada",53.8879226,-114.8997003,"Waubaushene, ON, Canada",44.7537016,-79.7121084,"1 day 10 hours",3256.825,2717.89887738656,97.1896448821247
"Seven Persons, AB T0K, Canada",49.8735127,-110.9063602,"Listowel, ON, Canada",43.7333296,-80.9515395,"1 day 5 hours",3023.38,2368.24742198346,105.914211202367
"Westlock, AB, Canada",54.1521734,-113.8514188,"Fleming, SK S0G, Canada",50.0755708,-101.5130316,"10 hours 27 mins",1094.881,957.41346911894,104.695378240544
"Sundre, AB, Canada",51.7972173,-114.6405002,"Cook's Harbour, NL, Canada",51.603697,-55.8708805,"2 days 21 hours",5942.296,3949.86907125225,86.4994504894647
"Bragg Creek, AB, Canada",50.9516847,-114.5691561,"Ste. Agathe, MB R0G, Canada",49.5690845,-97.1840432,"13 hours 12 mins",1381.927,1246.23792503956,104.647395877156
"Faust, AB T0G, Canada",55.31817,-115.637712,"Saint-Félix-de-Valois, QC J0K, Canada",46.1740366,-73.3997444,"1 day 17 hours",3864.772,3094.424038785,94.5233754322556
"Cadomin, AB T0E, Canada",53.0324813,-117.3268223,"Long Harbour-Mount Arlington Heights, NL, Canada",47.4317032,-53.815488,"3 days 0 hours",6312.766,4423.20513744921,87.7094521526022
"Grimshaw, AB T0H, Canada",56.1893767,-117.6105042,"Mary's Harbour, NL, Canada",52.3054507,-55.8373376,"2 days 21 hours",6073.328,3913.23001108299,88.552916732482
"Nisku, AB, Canada",53.3377723,-113.5240013,"Sainte-Anne-de-Bellevue, QC, Canada",45.4032673,-73.9504015,"1 day 14 hours",3611.299,2963.3673713397,96.1979829072478
"Rosalind, AB T0B, Canada",52.7874933,-112.4404529,"Colombier, QC, Canada",48.8542939,-68.9369297,"1 day 17 hours",3886.954,3048.73724223237,94.0152004192478
"Chateh, AB T0H, Canada",58.707471,-118.693053,"Watford, ON, Canada",42.9555663,-81.879921,"1 day 15 hours",4048.089,3069.78394328925,105.066331180067
"Canmore, AB, Canada",51.0749582,-115.3591374,"Port Dover, ON, Canada",42.7865022,-80.2033046,"1 day 8 hours",3433.549,2800.02776960961,105.943760767273
"Sylvan Lake, AB, Canada",52.3076936,-114.0980214,"Pontiac, QC, Canada",45.5635445,-76.108123,"1 day 12 hours",3484.505,2846.49803154912,96.3953647422253
"Vermilion, AB, Canada",53.3540163,-110.8586881,"Glaslyn, SK S0M, Canada",53.3604107,-108.3553203,"2 hours 5 mins",194.412,166.671723186155,93.5547654056944
"Ponoka, AB, Canada",52.6758713,-113.5832633,"Dubuisson, Val-d'Or, QC, Canada",48.1468909,-77.959725,"1 day 8 hours",3047.844,2554.27093265122,95.4066205817138
"Niton Junction, AB T0E, Canada",53.6171642,-115.7696143,"Atlin, BC V0W, Canada",59.577636,-133.6891954,"1 day 0 hours",1906.05,1279.3136572617,79.1914412334964
"Hussar, AB T0J, Canada",51.0410825,-112.6813763,"Armstrong, BC V0E, Canada",50.4476707,-119.1969832,"7 hours 6 mins",648.767,464.444404248438,91.3792088892367
"Etzikom, AB T0K, Canada",49.4787939,-111.1045186,"Hull, Gatineau, QC, Canada",45.4287295,-75.7133457,"1 day 9 hours",3125.816,2680.99887488742,95.1759458019335
"Morley, AB T0L, Canada",51.1618289,-114.8513984,"Williams Lake, BC, Canada",52.1418692,-122.1413196,"9 hours 19 mins",847.407,515.940740979703,90.9343388577561
"Andrew, AB T0B, Canada",53.879767,-112.3351752,"Portage-du-Fort, QC, Canada",45.593267,-76.6599724,"1 day 11 hours",3315.977,2697.81431810466,96.0024222733341
"Marwayne, AB T0B, Canada",53.5168861,-110.3314212,"Clinton, BC V0K, Canada",51.0927526,-121.5864344,"11 hours 24 mins",1121.055,812.663935839887,98.3597280105286
"Vulcan, AB T0L, Canada",50.4031726,-113.2612476,"Hickman's Harbour, NL A0C, Canada",48.1023547,-53.7308945,"2 days 20 hours",5902.656,4223.93520843181,87.3044815855643
"Keephills, AB T0E, Canada",53.4417861,-114.348653,"650 Rue du Domaine, SAINTE-AGATHE-SUD, QC J8C 3C9, Canada",46.0448699,-74.2551324,"1 day 13 hours",3532.446,2961.00463618917,95.0256349710443
"Hanna, AB T0J, Canada",51.643904,-111.9286419,"Sanmaur, Rivière-Windigo, QC G0X, Canada",47.8947525,-73.7941959,"1 day 16 hours",3546.686,2746.41556860989,88.3236690647482
"Okotoks, AB, Canada",50.7254937,-113.9749106,"Fair Haven, NL A0B, Canada",47.5342216,-53.8997127,"2 days 21 hours",6014.168,4276.87429074924,87.7856135584974
